{
  "$schema": "http://json-schema.org/draft-07/schema#",
  "title": "Plan",
  "description": "A structured development plan for agentic coding orchestrators",
  "type": "object",
  "required": ["$schema", "id", "goal", "context", "tasks"],
  "additionalProperties": false,
  "properties": {
    "$schema": {
      "type": "string",
      "const": "plan-v1",
      "description": "Schema version identifier"
    },
    "id": {
      "type": "string",
      "pattern": "^[a-z0-9][a-z0-9-]*[a-z0-9]$",
      "maxLength": 64,
      "description": "URL-safe slug identifying this plan"
    },
    "title": {
      "type": "string",
      "minLength": 3,
      "maxLength": 80,
      "description": "Short friendly label for UI/menus (keep under ~60 chars)"
    },
    "goal": {
      "type": "string",
      "minLength": 10,
      "maxLength": 500,
      "description": "One sentence describing the desired end state"
    },
    "context": {
      "type": "object",
      "required": ["tech_stack", "constraints"],
      "additionalProperties": false,
      "properties": {
        "tech_stack": {
          "type": "array",
          "items": { "type": "string" },
          "minItems": 1,
          "description": "Technologies to use"
        },
        "constraints": {
          "type": "array",
          "items": { "type": "string" },
          "description": "Hard rules and boundaries"
        },
        "references": {
          "type": "array",
          "items": {
            "type": "object",
            "required": ["path", "description"],
            "additionalProperties": false,
            "properties": {
              "path": { "type": "string" },
              "description": { "type": "string" }
            }
          },
          "description": "Files the LLM should read for context"
        }
      }
    },
    "tasks": {
      "type": "array",
      "minItems": 1,
      "items": {
        "type": "object",
        "required": [
          "id",
          "name",
          "description",
          "depends_on",
          "files",
          "verification"
        ],
        "additionalProperties": false,
        "properties": {
          "id": {
            "type": "string",
            "pattern": "^task-[0-9]+$",
            "description": "Format: task-{sequence}"
          },
          "name": {
            "type": "string",
            "maxLength": 80,
            "description": "Short display name for UI"
          },
          "description": {
            "type": "string",
            "minLength": 20,
            "description": "Detailed implementation instructions"
          },
          "depends_on": {
            "type": "array",
            "items": {
              "type": "string",
              "pattern": "^task-[0-9]+$"
            },
            "description": "Task IDs that must complete before this task can start"
          },
          "files": {
            "type": "array",
            "items": { "type": "string" },
            "minItems": 1,
            "description": "File paths this task will create or modify"
          },
          "verification": {
            "type": "array",
            "items": { "type": "string" },
            "minItems": 1,
            "description": "Concrete, testable assertions for completion"
          }
        }
      }
    }
  }
}
